<?xml version="1.0" encoding="utf-8"?>

<?xml-stylesheet type="txt/xsl" href="xml_xml_1.xsl" ?>
<!DOCTYPE catalog SYSTEM "cameras-catalog.dtd">

<catalog>

    <brand_info>
        <brand>Nikon</brand>
        <realise_date>25.07.1917</realise_date>
    </brand_info>

    <cameras>
        <camera type="mirrorless" resistance="dust-proof">

            <brand_info>
                <brand>Nikon</brand>
                <realise_date>23.12.2021</realise_date>
            </brand_info>

            <model>Z9</model>
            <price currency="лв">11 800</price>
            <color>Черен</color>
            <image>camera_images/nikon-z9.jpg</image>

            <features>

                <effective_pixels px="мегапиксела">46</effective_pixels>
                <wi-fi has="Yes"/>
                <processor>DIGIC X</processor>
                <display>сензорен TFT LCD с приблиз. 2 100 000 точки</display>
                <video max-duration="29:59">8K UHD/4K UHD</video>

            </features>

            <physical-specifications>
                <size s_unit="mm">149 x 149,5 x 90,5</size>
                <weight w_unit="g">1340</weight>
            </physical-specifications>

            <power_supply>
                <battery>Акумулаторна литиево-йонна батерия EN-EL18d</battery>
                <energy_saving>Захранването се изключва след 30 секунди, 1, 3, 5, 10 или 30 минути</energy_saving>
                <charger> Захранващ AC адаптер EH-7P; EH-6d; изисква конектор за захранването EP-6a</charger>
            </power_supply>

        </camera>


        <camera type="DSLR" resistance="dust-proof">

            <brand_info>
                <brand>Nikon</brand>
                <realise_date>06.01.2020</realise_date>
            </brand_info>

            <model>D780</model>
            <price currency="лв">4 500</price>
            <color>Черен</color>
            <image>camera_images/nikon-d780.jpg</image>

            <features>

                <effective_pixels px="мегапиксела">24</effective_pixels>
                <wi-fi has="Yes"/>
                <processor>AF-S обектив тип G с вграден процесор и бийонет F</processor>
                <display>сензорен TFT LCD дисплей с приблиз. 2 359 000 точки (XGA)</display>
                <video max-duration="50:59">4K UHD</video>

            </features>

            <physical-specifications>
                <size s_unit="mm">143,5 x 115,5 x 76</size>
                <weight w_unit="g">840</weight>
            </physical-specifications>

            <power_supply>
                <battery>Акумулаторна литиево-йонна батерия EN-EL15b</battery>
                <energy_saving>Захранването се изключва след 30 секунди, 1, 3, 5, 10 или 30 минути</energy_saving>
                <charger>Захранващ адаптер EH-5d/EH-5c/EH-5b; изисква конектор за захранването EP-5B </charger>
            </power_supply>


        </camera>

        <camera type="Compact" resistance="dust-proof">

            <brand_info>
                <brand>Nikon</brand>
                <realise_date>31.05.2017</realise_date>
            </brand_info>

            <model>COOLPIX W300</model>
            <price currency="лв">880</price>
            <color>Жълт</color>
            <image>camera_images/nikon-coolpix-w300-zhult-poda.jpg</image>

            <features>

                <effective_pixels px="мегапиксела">16</effective_pixels>
                <wi-fi has="Yes"/>
                <processor>AF-S обектив тип G с вграден процесор и бийонет F</processor>
                <display>7,5-сантиметров диагонал с приблизително 921 000 точки</display>
                <video max-duration="59:59">4K UHD</video>

            </features>

            <physical-specifications>
                <size s_unit="mm">111,5 x 66,0 x 29,0</size>
                <weight w_unit="g">231</weight>
            </physical-specifications>

            <power_supply>
                <battery>Акумулаторна литиево-йонна батерия EN-EL12</battery>
                <energy_saving>Захранването се изключва след  3, 5, 10 минути</energy_saving>
                <charger>Захранващ адаптер за зареждане на батерията във фотоапарата EH-73P </charger>
            </power_supply>


        </camera>




    </cameras>

</catalog>