<?xml version="1.0" encoding="utf-8" standalone="no"?>
<?xml-stylesheet type="txt/xsl" href="xml_html_1.xsl" ?>

<!DOCTYPE catalog SYSTEM "cameras-catalog.dtd">

<catalog>
    <brand_info>
        <brand>Canon</brand>
        <realise_date>10.09.1937</realise_date>
    </brand_info>

    <cameras>
        <camera type="DSLR" resistance="dust-proof">
        <brand_info>
            <brand>Canon</brand>
            <realise_date>18.07.2016</realise_date>

        </brand_info>
        <model>EOS 2000D</model>
        <price currency="лв">839</price>
        <color>Черен</color>
        <image>camera_images/Canon_EOS_2000D.jpg</image>
        <features>

            <effective_pixels px="мегапиксела"> 24 </effective_pixels>
            <wi-fi has="Yes"/>
            <processor>DIGIC 4+</processor>
            <display>TFT LCD, приблизително 920 000 точки</display>
            <video max-duration="29:59">MOV</video>

        </features>

        <physical-specifications>
            <size s_unit="mm"> 129,0 x 101,3 x 77,6</size>
            <weight w_unit="g">475</weight>

        </physical-specifications>
        <power_supply>
            <battery>Акумулаторна литиево-йонна батерия LP-E10</battery>
            <energy_saving>Захранването се изключва след 30 секунди, 1, 3, 5, 10 или 30 минути</energy_saving>
            <charger>Зарядно устройство LC-E10E, компактен захранващ адаптер CA-PS700, DC съединител DR-E10</charger>
        </power_supply>


    </camera>

        <camera type="mirrorless" resistance="dust-proof">

            <brand_info>
                <brand>Canon</brand>
                <realise_date>05.11.2021</realise_date>
            </brand_info>

            <model>EOS M50 Mark II</model>
            <price currency="лв">1349</price>
            <color>Черен</color>
            <image>camera_images/Canon EOS M50 Mark II.jpg</image>
            <features>

                <effective_pixels px="мегапиксела"> 24 </effective_pixels>
                <wi-fi has="Yes"/>
                <processor>DIGIC 8</processor>
                <display>сензорен LCD (TFT) дисплей с приблизително 1 040 000 точки</display>
                <video max-duration="29:59">4K/Full HD/HD</video>

            </features>

            <physical-specifications>
                <size s_unit="mm">116,3 x 88,1 x 58,7</size>
                <weight w_unit="g">387</weight>
            </physical-specifications>

            <power_supply>
                <battery>Акумулаторна литиево-йонна батерия LP-E12</battery>
                <energy_saving>Захранването се изключва след 30 секунди, 1, 3, 5, 10 или 30 минути</energy_saving>
                <charger>Зарядно устройство за батерии LC-E12,компактен захранващ адаптер CA-PS700, DC съединител DR-E12</charger>
            </power_supply>


        </camera>

    </cameras>

</catalog>